<?xml version="1.0" encoding="UTF-8"?>
<!DOCTYPE server PUBLIC
  "-//Penrose/DTD Server ${product.specification}//EN"
  "http://penrose.safehaus.org/dtd/server.dtd">

<server>

  <system-property>
    <property-name>java.rmi.server.hostname</property-name>
    <property-value>localhost</property-value>
  </system-property>

  <adapter name="JDBC">
    <adapter-class>org.safehaus.penrose.jdbc.adapter.JDBCAdapter</adapter-class>
  </adapter>

  <adapter name="LDAP">
    <adapter-class>org.safehaus.penrose.ldap.adapter.LDAPAdapter</adapter-class>
  </adapter>

  <adapter name="NIS">
    <adapter-class>org.safehaus.penrose.nis.adapter.NISAdapter</adapter-class>
  </adapter>

  <root>
    <root-dn>uid=admin,ou=system</root-dn>
    <root-password>secret</root-password>
  </root>

</server>
